{
  "schemaVersion": 1,
  "gridLayout": "oddQFlatTop",
  "cols": 7,
  "rows": 7,
  "mapName": "aonw2_starter",
  "defaultZoom": 1.0,
  "objectives": [
    {
      "id": "central_ruins",
      "type": "ruins",
      "hex": {
        "col": 3,
        "row": 3
      },
      "requiredHoldTurns": 3,
      "victoryPoints": 3,
      "goldPerTurn": 1
    }
  ],
  "tiles": [
    {
      "col": 0,
      "row": 0,
      "terrainTags": [
        "ocean"
      ],
      "resources": [],
      "height": 0
    },
    {
      "col": 1,
      "row": 0,
      "terrainTags": [
        "ocean"
      ],
      "resources": [
        "fish"
      ],
      "height": 0
    },
    {
      "col": 2,
      "row": 0,
      "terrainTags": [
        "coast"
      ],
      "resources": [],
      "height": 0
    },
    {
      "col": 3,
      "row": 0,
      "terrainTags": [
        "coast"
      ],
      "resources": [],
      "height": 0
    },
    {
      "col": 4,
      "row": 0,
      "terrainTags": [
        "coast"
      ],
      "resources": [],
      "height": 0
    },
    {
      "col": 5,
      "row": 0,
      "terrainTags": [
        "ocean"
      ],
      "resources": [
        "fish"
      ],
      "height": 0
    },
    {
      "col": 6,
      "row": 0,
      "terrainTags": [
        "ocean"
      ],
      "resources": [],
      "height": 0
    },
    {
      "col": 0,
      "row": 1,
      "terrainTags": [
        "ocean"
      ],
      "resources": [],
      "height": 0
    },
    {
      "col": 1,
      "row": 1,
      "terrainTags": [
        "coast"
      ],
      "resources": [
        "pearls"
      ],
      "height": 0
    },
    {
      "col": 2,
      "row": 1,
      "terrainTags": [
        "grassland"
      ],
      "resources": [
        "wheat"
      ],
      "height": 0
    },
    {
      "col": 3,
      "row": 1,
      "terrainTags": [
        "plains",
        "hills"
      ],
      "resources": [],
      "height": 1
    },
    {
      "col": 4,
      "row": 1,
      "terrainTags": [
        "grassland",
        "forest"
      ],
      "resources": [
        "deer"
      ],
      "height": 0
    },
    {
      "col": 5,
      "row": 1,
      "terrainTags": [
        "coast"
      ],
      "resources": [],
      "height": 0
    },
    {
      "col": 6,
      "row": 1,
      "terrainTags": [
        "ocean"
      ],
      "resources": [],
      "height": 0
    },
    {
      "col": 0,
      "row": 2,
      "terrainTags": [
        "coast"
      ],
      "resources": [],
      "height": 0
    },
    {
      "col": 1,
      "row": 2,
      "terrainTags": [
        "grassland",
        "forest"
      ],
      "resources": [],
      "height": 0
    },
    {
      "col": 2,
      "row": 2,
      "terrainTags": [
        "grassland"
      ],
      "resources": [
        "horses"
      ],
      "height": 0
    },
    {
      "col": 3,
      "row": 2,
      "terrainTags": [
        "plains",
        "river"
      ],
      "resources": [
        "wheat"
      ],
      "height": 0
    },
    {
      "col": 4,
      "row": 2,
      "terrainTags": [
        "plains",
        "hills"
      ],
      "resources": [
        "iron"
      ],
      "height": 1
    },
    {
      "col": 5,
      "row": 2,
      "terrainTags": [
        "grassland"
      ],
      "resources": [],
      "height": 0
    },
    {
      "col": 6,
      "row": 2,
      "terrainTags": [
        "coast"
      ],
      "resources": [],
      "height": 0
    },
    {
      "col": 0,
      "row": 3,
      "terrainTags": [
        "coast"
      ],
      "resources": [],
      "height": 0
    },
    {
      "col": 1,
      "row": 3,
      "terrainTags": [
        "plains"
      ],
      "resources": [
        "sheep"
      ],
      "height": 0
    },
    {
      "col": 2,
      "row": 3,
      "terrainTags": [
        "plains",
        "hills"
      ],
      "resources": [],
      "height": 1
    },
    {
      "col": 3,
      "row": 3,
      "terrainTags": [
        "grassland"
      ],
      "resources": [],
      "height": 0
    },
    {
      "col": 4,
      "row": 3,
      "terrainTags": [
        "plains",
        "river"
      ],
      "resources": [],
      "height": 0
    },
    {
      "col": 5,
      "row": 3,
      "terrainTags": [
        "grassland",
        "forest"
      ],
      "resources": [
        "deer"
      ],
      "height": 0
    },
    {
      "col": 6,
      "row": 3,
      "terrainTags": [
        "coast"
      ],
      "resources": [],
      "height": 0
    },
    {
      "col": 0,
      "row": 4,
      "terrainTags": [
        "coast"
      ],
      "resources": [],
      "height": 0
    },
    {
      "col": 1,
      "row": 4,
      "terrainTags": [
        "grassland"
      ],
      "resources": [],
      "height": 0
    },
    {
      "col": 2,
      "row": 4,
      "terrainTags": [
        "grassland",
        "wetlands"
      ],
      "resources": [
        "rice"
      ],
      "height": 0
    },
    {
      "col": 3,
      "row": 4,
      "terrainTags": [
        "plains",
        "river"
      ],
      "resources": [],
      "height": 0
    },
    {
      "col": 4,
      "row": 4,
      "terrainTags": [
        "grassland"
      ],
      "resources": [
        "wheat"
      ],
      "height": 0
    },
    {
      "col": 5,
      "row": 4,
      "terrainTags": [
        "plains",
        "hills"
      ],
      "resources": [],
      "height": 1
    },
    {
      "col": 6,
      "row": 4,
      "terrainTags": [
        "coast"
      ],
      "resources": [
        "fish"
      ],
      "height": 0
    },
    {
      "col": 0,
      "row": 5,
      "terrainTags": [
        "ocean"
      ],
      "resources": [],
      "height": 0
    },
    {
      "col": 1,
      "row": 5,
      "terrainTags": [
        "coast"
      ],
      "resources": [],
      "height": 0
    },
    {
      "col": 2,
      "row": 5,
      "terrainTags": [
        "grassland",
        "forest"
      ],
      "resources": [],
      "height": 0
    },
    {
      "col": 3,
      "row": 5,
      "terrainTags": [
        "plains",
        "hills"
      ],
      "resources": [
        "marble"
      ],
      "height": 1
    },
    {
      "col": 4,
      "row": 5,
      "terrainTags": [
        "mountain"
      ],
      "resources": [
        "iron"
      ],
      "height": 2
    },
    {
      "col": 5,
      "row": 5,
      "terrainTags": [
        "coast"
      ],
      "resources": [],
      "height": 0
    },
    {
      "col": 6,
      "row": 5,
      "terrainTags": [
        "ocean"
      ],
      "resources": [],
      "height": 0
    },
    {
      "col": 0,
      "row": 6,
      "terrainTags": [
        "ocean"
      ],
      "resources": [],
      "height": 0
    },
    {
      "col": 1,
      "row": 6,
      "terrainTags": [
        "ocean"
      ],
      "resources": [],
      "height": 0
    },
    {
      "col": 2,
      "row": 6,
      "terrainTags": [
        "coast"
      ],
      "resources": [],
      "height": 0
    },
    {
      "col": 3,
      "row": 6,
      "terrainTags": [
        "coast"
      ],
      "resources": [
        "fish"
      ],
      "height": 0
    },
    {
      "col": 4,
      "row": 6,
      "terrainTags": [
        "coast"
      ],
      "resources": [],
      "height": 0
    },
    {
      "col": 5,
      "row": 6,
      "terrainTags": [
        "ocean"
      ],
      "resources": [],
      "height": 0
    },
    {
      "col": 6,
      "row": 6,
      "terrainTags": [
        "ocean"
      ],
      "resources": [],
      "height": 0
    }
  ]
}
